<?xml version="1.0" encoding="utf-8"?>
<xs:schema xmlns:xsi="http://www.w3.org/2001/XMLSchema-instance" xmlns:xlink="http://www.w3.org/1999/xlink" attributeFormDefault="unqualified" elementFormDefault="qualified" xmlns:xs="http://www.w3.org/2001/XMLSchema">
  <xs:import schemaLocation="schema1.xsd" namespace="http://www.w3.org/1999/xlink" />
  <xs:element name="Contact">
    <xs:complexType>
      <xs:sequence>
        <xs:element name="navbar">
          <xs:complexType>
            <xs:sequence>
              <xs:element name="Header" type="xs:string" />
              <xs:element name="Home">
                <xs:complexType>
                  <xs:simpleContent>
                    <xs:extension base="xs:string">
                      <xs:attribute ref="xlink:type" use="required" />
                      <xs:attribute ref="xlink:href" use="required" />
                    </xs:extension>
                  </xs:simpleContent>
                </xs:complexType>
              </xs:element>
              <xs:element name="Product">
                <xs:complexType>
                  <xs:simpleContent>
                    <xs:extension base="xs:string">
                      <xs:attribute ref="xlink:type" use="required" />
                      <xs:attribute ref="xlink:href" use="required" />
                    </xs:extension>
                  </xs:simpleContent>
                </xs:complexType>
              </xs:element>
              <xs:element name="About">
                <xs:complexType>
                  <xs:simpleContent>
                    <xs:extension base="xs:string">
                      <xs:attribute ref="xlink:type" use="required" />
                      <xs:attribute ref="xlink:href" use="required" />
                    </xs:extension>
                  </xs:simpleContent>
                </xs:complexType>
              </xs:element>
              <xs:element name="Contact">
                <xs:complexType>
                  <xs:simpleContent>
                    <xs:extension base="xs:string">
                      <xs:attribute ref="xlink:type" use="required" />
                      <xs:attribute ref="xlink:href" use="required" />
                    </xs:extension>
                  </xs:simpleContent>
                </xs:complexType>
              </xs:element>
              <xs:element name="Service">
                <xs:complexType>
                  <xs:simpleContent>
                    <xs:extension base="xs:string">
                      <xs:attribute ref="xlink:type" use="required" />
                      <xs:attribute ref="xlink:href" use="required" />
                    </xs:extension>
                  </xs:simpleContent>
                </xs:complexType>
              </xs:element>
            </xs:sequence>
          </xs:complexType>
        </xs:element>
        <xs:element name="body">
          <xs:complexType>
            <xs:sequence>
              <xs:element name="box">
                <xs:complexType>
                  <xs:sequence>
                    <xs:element name="Email" type="xs:string" />
                    <xs:element name="Phone" type="xs:unsignedInt" />
                    <xs:element name="Location" type="xs:string" />
                  </xs:sequence>
                </xs:complexType>
              </xs:element>
            </xs:sequence>
          </xs:complexType>
        </xs:element>
        <xs:element name="footer-icon">
          <xs:complexType>
            <xs:sequence>
              <xs:element name="Facebook">
                <xs:complexType>
                  <xs:simpleContent>
                    <xs:extension base="xs:string">
                      <xs:attribute ref="xlink:type" use="required" />
                      <xs:attribute ref="xlink:href" use="required" />
                    </xs:extension>
                  </xs:simpleContent>
                </xs:complexType>
              </xs:element>
              <xs:element name="Twitter">
                <xs:complexType>
                  <xs:simpleContent>
                    <xs:extension base="xs:string">
                      <xs:attribute ref="xlink:type" use="required" />
                      <xs:attribute ref="xlink:href" use="required" />
                    </xs:extension>
                  </xs:simpleContent>
                </xs:complexType>
              </xs:element>
              <xs:element name="Instagram">
                <xs:complexType>
                  <xs:simpleContent>
                    <xs:extension base="xs:string">
                      <xs:attribute ref="xlink:type" use="required" />
                      <xs:attribute ref="xlink:href" use="required" />
                    </xs:extension>
                  </xs:simpleContent>
                </xs:complexType>
              </xs:element>
            </xs:sequence>
          </xs:complexType>
        </xs:element>
        <xs:element name="footer-link">
          <xs:complexType>
            <xs:sequence>
              <xs:element name="Home">
                <xs:complexType>
                  <xs:simpleContent>
                    <xs:extension base="xs:string">
                      <xs:attribute ref="xlink:type" use="required" />
                      <xs:attribute ref="xlink:href" use="required" />
                    </xs:extension>
                  </xs:simpleContent>
                </xs:complexType>
              </xs:element>
              <xs:element name="About">
                <xs:complexType>
                  <xs:simpleContent>
                    <xs:extension base="xs:string">
                      <xs:attribute ref="xlink:type" use="required" />
                      <xs:attribute ref="xlink:href" use="required" />
                    </xs:extension>
                  </xs:simpleContent>
                </xs:complexType>
              </xs:element>
              <xs:element name="Contact">
                <xs:complexType>
                  <xs:simpleContent>
                    <xs:extension base="xs:string">
                      <xs:attribute ref="xlink:type" use="required" />
                      <xs:attribute ref="xlink:href" use="required" />
                    </xs:extension>
                  </xs:simpleContent>
                </xs:complexType>
              </xs:element>
              <xs:element name="Service">
                <xs:complexType>
                  <xs:simpleContent>
                    <xs:extension base="xs:string">
                      <xs:attribute ref="xlink:type" use="required" />
                      <xs:attribute ref="xlink:href" use="required" />
                    </xs:extension>
                  </xs:simpleContent>
                </xs:complexType>
              </xs:element>
            </xs:sequence>
          </xs:complexType>
        </xs:element>
        <xs:element name="footer">
          <xs:complexType>
            <xs:sequence>
              <xs:element name="copyright" type="xs:string" />
            </xs:sequence>
          </xs:complexType>
        </xs:element>
      </xs:sequence>
    </xs:complexType>
  </xs:element>
</xs:schema>